    1   0.000000 168.150.105.141 → 216.58.195.238 TCP 1434 [TCP segment of a reassembled PDU]
    2   0.000012 168.150.105.141 → 216.58.195.238 TLSv1.2 356 Application Data
    3   0.006442 216.58.195.238 → 168.150.105.141 TCP 66 443 → 55455 [ACK] Seq=1 Ack=1369 Win=405 Len=0 TSval=1021173877 TSecr=295756594
    4   0.006444 216.58.195.238 → 168.150.105.141 TCP 66 443 → 55455 [ACK] Seq=1 Ack=1659 Win=416 Len=0 TSval=1021173877 TSecr=295756594
    5   0.121312 216.58.195.238 → 168.150.105.141 TLSv1.2 298 Application Data
    6   0.121315 216.58.195.238 → 168.150.105.141 TLSv1.2 1440 Application Data
    7   0.121364 168.150.105.141 → 216.58.195.238 TCP 66 55455 → 443 [ACK] Seq=1659 Ack=233 Win=4088 Len=0 TSval=295756713 TSecr=1021173991
    8   0.121393 168.150.105.141 → 216.58.195.238 TCP 66 55455 → 443 [ACK] Seq=1659 Ack=1607 Win=4045 Len=0 TSval=295756713 TSecr=1021173991
    9   0.122620 216.58.195.238 → 168.150.105.141 TLSv1.2 257 Application Data
   10   0.122647 168.150.105.141 → 216.58.195.238 TCP 66 55455 → 443 [ACK] Seq=1659 Ack=1798 Win=4090 Len=0 TSval=295756714 TSecr=1021173991
   11   0.124269 216.58.195.238 → 168.150.105.141 TLSv1.2 121 Application Data
   12   0.124272 216.58.195.238 → 168.150.105.141 TLSv1.2 112 Application Data
   13   0.124296 168.150.105.141 → 216.58.195.238 TCP 66 55455 → 443 [ACK] Seq=1659 Ack=1853 Win=4088 Len=0 TSval=295756715 TSecr=1021173995
   14   0.124313 168.150.105.141 → 216.58.195.238 TCP 66 55455 → 443 [ACK] Seq=1659 Ack=1899 Win=4086 Len=0 TSval=295756715 TSecr=1021173995
   15   0.126819 168.150.105.141 → 216.58.195.238 TLSv1.2 112 Application Data
   16   0.132450 216.58.195.238 → 168.150.105.141 TCP 66 443 → 55455 [ACK] Seq=1899 Ack=1705 Win=416 Len=0 TSval=1021174003 TSecr=295756717
   17   1.319447 168.150.105.141 → 74.125.197.189 TLSv1.2 1010 Application Data
   18   1.343291 74.125.197.189 → 168.150.105.141 TCP 66 443 → 55571 [ACK] Seq=1 Ack=945 Win=202 Len=0 TSval=3614852422 TSecr=295757906
   19   1.386080 74.125.197.189 → 168.150.105.141 TLSv1.2 215 Application Data
   20   1.386082 74.125.197.189 → 168.150.105.141 TLSv1.2 435 Application Data, Application Data
   21   1.386083 74.125.197.189 → 168.150.105.141 TLSv1.2 112 Application Data
   22   1.386129 168.150.105.141 → 74.125.197.189 TCP 66 55571 → 443 [ACK] Seq=945 Ack=150 Win=4091 Len=0 TSval=295757971 TSecr=3614852461
   23   1.386150 168.150.105.141 → 74.125.197.189 TCP 66 55571 → 443 [ACK] Seq=945 Ack=519 Win=4079 Len=0 TSval=295757971 TSecr=3614852461
   24   1.386161 168.150.105.141 → 74.125.197.189 TCP 66 55571 → 443 [ACK] Seq=945 Ack=565 Win=4078 Len=0 TSval=295757971 TSecr=3614852461
   25   1.386532 168.150.105.141 → 74.125.197.189 TLSv1.2 112 Application Data
   26   1.390606 168.150.105.141 → 74.125.197.189 TLSv1.2 130 Application Data
   27   1.413436 74.125.197.189 → 168.150.105.141 TCP 66 443 → 55571 [ACK] Seq=565 Ack=1055 Win=202 Len=0 TSval=3614852492 TSecr=295757971
   28   1.450358 74.125.197.189 → 168.150.105.141 TLSv1.2 116 Application Data
   29   1.450445 168.150.105.141 → 74.125.197.189 TCP 66 55571 → 443 [ACK] Seq=1055 Ack=615 Win=4094 Len=0 TSval=295758033 TSecr=3614852529
   30   1.450467 74.125.197.189 → 168.150.105.141 TLSv1.2 336 Application Data
   31   1.450506 168.150.105.141 → 74.125.197.189 TCP 66 55571 → 443 [ACK] Seq=1055 Ack=885 Win=4086 Len=0 TSval=295758033 TSecr=3614852529
   32   1.450759 74.125.197.189 → 168.150.105.141 TLSv1.2 149 Application Data
   33   1.450762 74.125.197.189 → 168.150.105.141 TLSv1.2 112 Application Data
   34   1.450793 168.150.105.141 → 74.125.197.189 TCP 66 55571 → 443 [ACK] Seq=1055 Ack=968 Win=4093 Len=0 TSval=295758033 TSecr=3614852529
   35   1.450811 168.150.105.141 → 74.125.197.189 TCP 66 55571 → 443 [ACK] Seq=1055 Ack=1014 Win=4091 Len=0 TSval=295758033 TSecr=3614852530
   36   1.451310 168.150.105.141 → 74.125.197.189 TLSv1.2 112 Application Data
   37   1.460559 168.150.105.141 → 74.125.197.189 TLSv1.2 343 Application Data
   38   1.483866 74.125.197.189 → 168.150.105.141 TCP 66 443 → 55571 [ACK] Seq=1014 Ack=1378 Win=213 Len=0 TSval=3614852562 TSecr=295758033
   39   1.530164 74.125.197.189 → 168.150.105.141 TLSv1.2 364 Application Data
   40   1.530167 74.125.197.189 → 168.150.105.141 TLSv1.2 233 Application Data
   41   1.530211 168.150.105.141 → 74.125.197.189 TCP 66 55571 → 443 [ACK] Seq=1378 Ack=1312 Win=4086 Len=0 TSval=295758112 TSecr=3614852602
   42   1.530231 168.150.105.141 → 74.125.197.189 TCP 66 55571 → 443 [ACK] Seq=1378 Ack=1479 Win=4081 Len=0 TSval=295758112 TSecr=3614852602
   43   1.530462 74.125.197.189 → 168.150.105.141 TLSv1.2 267 Application Data
   44   1.530479 168.150.105.141 → 74.125.197.189 TCP 66 55571 → 443 [ACK] Seq=1378 Ack=1680 Win=4075 Len=0 TSval=295758112 TSecr=3614852602
   45   1.532569 74.125.197.189 → 168.150.105.141 TLSv1.2 112 Application Data
   46   1.532604 168.150.105.141 → 74.125.197.189 TCP 66 55571 → 443 [ACK] Seq=1378 Ack=1726 Win=4073 Len=0 TSval=295758114 TSecr=3614852602
   47   1.534671 168.150.105.141 → 74.125.197.189 TLSv1.2 112 Application Data
   48   1.543085 168.150.105.141 → 74.125.197.189 TLSv1.2 870 Application Data
   49   1.567700 74.125.197.189 → 168.150.105.141 TCP 66 443 → 55571 [ACK] Seq=1726 Ack=2228 Win=224 Len=0 TSval=3614852645 TSecr=295758115
   50   1.605101 74.125.197.189 → 168.150.105.141 TLSv1.2 250 Application Data
   51   1.605105 74.125.197.189 → 168.150.105.141 TLSv1.2 109 Application Data
   52   1.605154 168.150.105.141 → 74.125.197.189 TCP 66 55571 → 443 [ACK] Seq=2228 Ack=1910 Win=4090 Len=0 TSval=295758184 TSecr=3614852683
   53   1.605171 168.150.105.141 → 74.125.197.189 TCP 66 55571 → 443 [ACK] Seq=2228 Ack=1953 Win=4088 Len=0 TSval=295758184 TSecr=3614852683
   54   1.608723 168.150.105.141 → 74.125.197.189 TLSv1.2 108 Application Data
   55   1.673388 74.125.197.189 → 168.150.105.141 TCP 66 443 → 55571 [ACK] Seq=1953 Ack=2270 Win=224 Len=0 TSval=3614852710 TSecr=295758187
   56   1.904132 168.150.105.141 → 74.125.197.189 TLSv1.2 959 Application Data
   57   1.904402 168.150.105.141 → 74.125.197.189 TLSv1.2 111 Application Data
   60   1.927521 74.125.197.189 → 168.150.105.141 TCP 66 443 → 55571 [ACK] Seq=1953 Ack=3163 Win=234 Len=0 TSval=3614853006 TSecr=295758479
   61   1.927522 74.125.197.189 → 168.150.105.141 TCP 66 443 → 55571 [ACK] Seq=1953 Ack=3208 Win=234 Len=0 TSval=3614853007 TSecr=295758479
   62   2.000303 74.125.197.189 → 168.150.105.141 TLSv1.2 274 Application Data
   63   2.000306 74.125.197.189 → 168.150.105.141 TLSv1.2 280 Application Data
   64   2.000307 74.125.197.189 → 168.150.105.141 TLSv1.2 129 Application Data
   65   2.000309 74.125.197.189 → 168.150.105.141 TLSv1.2 112 Application Data
   66   2.000350 168.150.105.141 → 74.125.197.189 TCP 66 55571 → 443 [ACK] Seq=3208 Ack=2161 Win=4089 Len=0 TSval=295758574 TSecr=3614853045
   67   2.000366 168.150.105.141 → 74.125.197.189 TCP 66 55571 → 443 [ACK] Seq=3208 Ack=2375 Win=4082 Len=0 TSval=295758574 TSecr=3614853045
   68   2.000374 168.150.105.141 → 74.125.197.189 TCP 66 55571 → 443 [ACK] Seq=3208 Ack=2438 Win=4080 Len=0 TSval=295758574 TSecr=3614853046
   69   2.000382 168.150.105.141 → 74.125.197.189 TCP 66 55571 → 443 [ACK] Seq=3208 Ack=2484 Win=4079 Len=0 TSval=295758574 TSecr=3614853046
   70   2.000831 168.150.105.141 → 74.125.197.189 TLSv1.2 112 Application Data
   71   2.063760 74.125.197.189 → 168.150.105.141 TCP 66 443 → 55571 [ACK] Seq=2484 Ack=3254 Win=234 Len=0 TSval=3614853103 TSecr=295758574
   72   2.871492 168.150.105.141 → 52.10.249.124 TCP 66 55472 → 80 [FIN, ACK] Seq=1 Ack=1 Win=4096 Len=0 TSval=295759441 TSecr=679757758
   73   2.872054 168.150.105.141 → 52.0.157.237 TCP 66 55556 → 443 [FIN, ACK] Seq=1 Ack=1 Win=4096 Len=0 TSval=295759441 TSecr=3074738132
   74   2.898800 168.150.105.141 → 74.125.197.189 TLSv1.2 997 Application Data
   75   2.899632 52.10.249.124 → 168.150.105.141 TCP 66 80 → 55472 [FIN, ACK] Seq=1 Ack=2 Win=137 Len=0 TSval=679768269 TSecr=295759441
   76   2.899698 168.150.105.141 → 52.10.249.124 TCP 66 55472 → 80 [ACK] Seq=2 Ack=2 Win=4096 Len=0 TSval=295759468 TSecr=679768269
   77   2.929789 74.125.197.189 → 168.150.105.141 TCP 66 443 → 55571 [ACK] Seq=2484 Ack=4185 Win=245 Len=0 TSval=3614854000 TSecr=295759468
   78   2.952276 52.0.157.237 → 168.150.105.141 TCP 66 443 → 55556 [ACK] Seq=1 Ack=2 Win=119 Len=0 TSval=3074743608 TSecr=295759441
   79   2.966915 74.125.197.189 → 168.150.105.141 TLSv1.2 271 Application Data
   80   2.966919 74.125.197.189 → 168.150.105.141 TLSv1.2 261 Application Data
   81   2.966964 168.150.105.141 → 74.125.197.189 TCP 66 55571 → 443 [ACK] Seq=4185 Ack=2689 Win=4089 Len=0 TSval=295759534 TSecr=3614854040
   82   2.966980 168.150.105.141 → 74.125.197.189 TCP 66 55571 → 443 [ACK] Seq=4185 Ack=2884 Win=4083 Len=0 TSval=295759534 TSecr=3614854040
   84   3.903887 168.150.105.141 → 172.217.5.110 TLSv1.2 1091 Application Data
   85   3.905278 168.150.105.141 → 172.217.5.110 TLSv1.2 195 Application Data
   86   3.910335 172.217.5.110 → 168.150.105.141 TCP 66 443 → 55459 [ACK] Seq=1 Ack=1026 Win=346 Len=0 TSval=2253280206 TSecr=295760468
   87   3.910337 172.217.5.110 → 168.150.105.141 TCP 66 443 → 55459 [ACK] Seq=1 Ack=1155 Win=357 Len=0 TSval=2253280207 TSecr=295760469
   88   3.938247 172.217.5.110 → 168.150.105.141 TLSv1.2 373 Application Data
   89   3.938250 172.217.5.110 → 168.150.105.141 TLSv1.2 112 Application Data
   90   3.938251 172.217.5.110 → 168.150.105.141 TLSv1.2 123 Application Data
   91   3.938293 168.150.105.141 → 172.217.5.110 TCP 66 55459 → 443 [ACK] Seq=1155 Ack=308 Win=4086 Len=0 TSval=295760501 TSecr=2253280227
   92   3.938310 168.150.105.141 → 172.217.5.110 TCP 66 55459 → 443 [ACK] Seq=1155 Ack=354 Win=4084 Len=0 TSval=295760501 TSecr=2253280227
   93   3.938318 168.150.105.141 → 172.217.5.110 TCP 66 55459 → 443 [ACK] Seq=1155 Ack=411 Win=4083 Len=0 TSval=295760501 TSecr=2253280227
   94   3.938907 168.150.105.141 → 172.217.5.110 TLSv1.2 112 Application Data
   95   3.942375 168.150.105.141 → 172.217.5.110 TLSv1.2 945 Application Data
   96   3.942440 168.150.105.141 → 172.217.5.110 TLSv1.2 509 Application Data
   97   3.942902 168.150.105.141 → 172.217.5.110 TLSv1.2 239 Application Data
   98   3.943004 168.150.105.141 → 172.217.5.110 TLSv1.2 220 Application Data
   99   3.948395 172.217.5.110 → 168.150.105.141 TCP 66 443 → 55459 [ACK] Seq=411 Ack=2080 Win=367 Len=0 TSval=2253280244 TSecr=295760501
  100   3.950275 172.217.5.110 → 168.150.105.141 TCP 66 443 → 55459 [ACK] Seq=411 Ack=2696 Win=389 Len=0 TSval=2253280244 TSecr=295760505
  105   3.989429 172.217.5.110 → 168.150.105.141 TCP 66 443 → 55459 [ACK] Seq=411 Ack=2850 Win=399 Len=0 TSval=2253280245 TSecr=295760505
  106   4.048797 172.217.5.110 → 168.150.105.141 TLSv1.2 458 Application Data
  107   4.048800 172.217.5.110 → 168.150.105.141 TLSv1.2 260 Application Data
  108   4.048831 168.150.105.141 → 172.217.5.110 TCP 66 55459 → 443 [ACK] Seq=2850 Ack=803 Win=4083 Len=0 TSval=295760609 TSecr=2253280344
  109   4.048842 168.150.105.141 → 172.217.5.110 TCP 66 55459 → 443 [ACK] Seq=2850 Ack=997 Win=4077 Len=0 TSval=295760609 TSecr=2253280344
  110   4.049051 172.217.5.110 → 168.150.105.141 TLSv1.2 288 Application Data
  111   4.049053 172.217.5.110 → 168.150.105.141 TLSv1.2 112 Application Data
  112   4.049069 168.150.105.141 → 172.217.5.110 TCP 66 55459 → 443 [ACK] Seq=2850 Ack=1219 Win=4089 Len=0 TSval=295760609 TSecr=2253280344
  113   4.049081 168.150.105.141 → 172.217.5.110 TCP 66 55459 → 443 [ACK] Seq=2850 Ack=1265 Win=4087 Len=0 TSval=295760609 TSecr=2253280344
  114   4.049381 168.150.105.141 → 172.217.5.110 TLSv1.2 112 Application Data
  115   4.055557 172.217.5.110 → 168.150.105.141 TCP 66 443 → 55459 [ACK] Seq=1265 Ack=2896 Win=399 Len=0 TSval=2253280351 TSecr=295760609
  116   4.097026 172.217.5.110 → 168.150.105.141 TLSv1.2 309 Application Data
  117   4.097029 172.217.5.110 → 168.150.105.141 TLSv1.2 323 Application Data, Application Data
  118   4.097070 168.150.105.141 → 172.217.5.110 TCP 66 55459 → 443 [ACK] Seq=2896 Ack=1508 Win=4088 Len=0 TSval=295760656 TSecr=2253280392
  119   4.097086 168.150.105.141 → 172.217.5.110 TCP 66 55459 → 443 [ACK] Seq=2896 Ack=1765 Win=4080 Len=0 TSval=295760656 TSecr=2253280392
  120   4.098568 172.217.5.110 → 168.150.105.141 TLSv1.2 112 Application Data
  121   4.098614 168.150.105.141 → 172.217.5.110 TCP 66 55459 → 443 [ACK] Seq=2896 Ack=1811 Win=4094 Len=0 TSval=295760657 TSecr=2253280392
  122   4.098946 168.150.105.141 → 172.217.5.110 TLSv1.2 112 Application Data
  123   4.104521 172.217.5.110 → 168.150.105.141 TCP 66 443 → 55459 [ACK] Seq=1811 Ack=2942 Win=399 Len=0 TSval=2253280400 TSecr=295760657
  124   4.238890 168.150.105.141 → 162.125.7.3  TLSv1.2 1276 Application Data
  125   4.259060  162.125.7.3 → 168.150.105.141 TCP 66 443 → 55542 [ACK] Seq=1 Ack=1211 Win=76 Len=0 TSval=751967903 TSecr=295760795
  126   4.531918  162.125.7.3 → 168.150.105.141 TLSv1.2 658 Application Data
  127   4.531957 168.150.105.141 → 162.125.7.3  TCP 66 55542 → 443 [ACK] Seq=1211 Ack=593 Win=4077 Len=0 TSval=295761086 TSecr=751967964
  128   4.589497 168.150.105.141 → 162.125.2.4  TCP 66 55415 → 443 [FIN, ACK] Seq=1 Ack=1 Win=4096 Len=0 TSval=295761143 TSecr=1550404175
  131   4.608672  162.125.2.4 → 168.150.105.141 TCP 60 443 → 55415 [RST] Seq=1 Win=0 Len=0
  135   4.899055 168.150.105.141 → 74.125.197.189 TLSv1.2 896 Application Data
  136   4.899262 168.150.105.141 → 74.125.197.189 TLSv1.2 419 Application Data
  137   4.901314 168.150.105.141 → 172.217.5.110 TLSv1.2 807 Application Data
  138   4.901444 168.150.105.141 → 172.217.5.110 TLSv1.2 248 Application Data
  139   4.917437 172.217.5.110 → 168.150.105.141 TCP 66 443 → 55459 [ACK] Seq=1811 Ack=3683 Win=410 Len=0 TSval=2253281203 TSecr=295761453
  140   4.917440 172.217.5.110 → 168.150.105.141 TCP 66 443 → 55459 [ACK] Seq=1811 Ack=3865 Win=421 Len=0 TSval=2253281203 TSecr=295761453
  141   4.928840 74.125.197.189 → 168.150.105.141 TCP 66 443 → 55571 [ACK] Seq=2884 Ack=5368 Win=267 Len=0 TSval=3614856001 TSecr=295761451
  142   4.963166 74.125.197.189 → 168.150.105.141 TLSv1.2 278 Application Data
  143   4.963168 74.125.197.189 → 168.150.105.141 TLSv1.2 386 Application Data, Application Data
  144   4.963202 168.150.105.141 → 74.125.197.189 TCP 66 55571 → 443 [ACK] Seq=5368 Ack=3096 Win=4089 Len=0 TSval=295761513 TSecr=3614856042
  145   4.963218 168.150.105.141 → 74.125.197.189 TCP 66 55571 → 443 [ACK] Seq=5368 Ack=3416 Win=4079 Len=0 TSval=295761513 TSecr=3614856042
  146   4.965858 74.125.197.189 → 168.150.105.141 TLSv1.2 112 Application Data
  147   4.965892 168.150.105.141 → 74.125.197.189 TCP 66 55571 → 443 [ACK] Seq=5368 Ack=3462 Win=4094 Len=0 TSval=295761515 TSecr=3614856042
  148   4.966084 168.150.105.141 → 74.125.197.189 TLSv1.2 112 Application Data
  151   5.020786 172.217.5.110 → 168.150.105.141 TLSv1.2 308 Application Data
  152   5.020789 172.217.5.110 → 168.150.105.141 TLSv1.2 502 Application Data, Application Data
  153   5.020838 168.150.105.141 → 172.217.5.110 TCP 66 55459 → 443 [ACK] Seq=3865 Ack=2053 Win=4088 Len=0 TSval=295761569 TSecr=2253281313
  154   5.020856 168.150.105.141 → 172.217.5.110 TCP 66 55459 → 443 [ACK] Seq=3865 Ack=2489 Win=4074 Len=0 TSval=295761569 TSecr=2253281313
  155   5.022197 172.217.5.110 → 168.150.105.141 TLSv1.2 112 Application Data
  156   5.022229 168.150.105.141 → 172.217.5.110 TCP 66 55459 → 443 [ACK] Seq=3865 Ack=2535 Win=4094 Len=0 TSval=295761570 TSecr=2253281313
  157   5.022486 168.150.105.141 → 172.217.5.110 TLSv1.2 112 Application Data
  158   5.028470 172.217.5.110 → 168.150.105.141 TCP 66 443 → 55459 [ACK] Seq=2535 Ack=3911 Win=421 Len=0 TSval=2253281324 TSecr=295761570
  159   5.030072 74.125.197.189 → 168.150.105.141 TCP 66 443 → 55571 [ACK] Seq=3462 Ack=5414 Win=267 Len=0 TSval=3614856068 TSecr=295761515
  162   5.090740 168.150.105.141 → 162.125.7.4  TCP 78 55575 → 443 [SYN] Seq=0 Win=65535 Len=0 MSS=1460 WS=32 TSval=295761637 TSecr=0 SACK_PERM=1
  163   5.096517  162.125.7.4 → 168.150.105.141 TCP 74 443 → 55575 [SYN, ACK] Seq=0 Ack=1 Win=28560 Len=0 MSS=1386 SACK_PERM=1 TSval=550770008 TSecr=295761637 WS=512
  164   5.096572 168.150.105.141 → 162.125.7.4  TCP 66 55575 → 443 [ACK] Seq=1 Ack=1 Win=131904 Len=0 TSval=295761642 TSecr=550770008
  165   5.097298 168.150.105.141 → 162.125.7.4  SSL 253 Client Hello
  166   5.102440  162.125.7.4 → 168.150.105.141 TCP 66 443 → 55575 [ACK] Seq=1 Ack=188 Win=29696 Len=0 TSval=550770010 TSecr=295761642
  167   5.104839  162.125.7.4 → 168.150.105.141 TLSv1.2 1440 Server Hello
  168   5.104842  162.125.7.4 → 168.150.105.141 TCP 1440 [TCP segment of a reassembled PDU]
  169   5.104889 168.150.105.141 → 162.125.7.4  TCP 66 55575 → 443 [ACK] Seq=188 Ack=2749 Win=129152 Len=0 TSval=295761649 TSecr=550770011
  170   5.105485  162.125.7.4 → 168.150.105.141 TLSv1.2 1440 Certificate[TCP segment of a reassembled PDU]
  171   5.105581 168.150.105.141 → 162.125.7.4  TCP 66 55575 → 443 [ACK] Seq=188 Ack=4123 Win=130752 Len=0 TSval=295761649 TSecr=550770011
  172   5.106478  162.125.7.4 → 168.150.105.141 TLSv1.2 99 Server Key ExchangeServer Hello Done
  173   5.106503 168.150.105.141 → 162.125.7.4  TCP 66 55575 → 443 [ACK] Seq=188 Ack=4156 Win=131008 Len=0 TSval=295761650 TSecr=550770011
  174   5.107087 168.150.105.141 → 162.125.7.4  TLSv1.2 192 Client Key Exchange, Change Cipher Spec, Encrypted Handshake Message
  175   5.114049  162.125.7.4 → 168.150.105.141 TLSv1.2 340 New Session Ticket, Change Cipher Spec, Encrypted Handshake Message
  176   5.114092 168.150.105.141 → 162.125.7.4  TCP 66 55575 → 443 [ACK] Seq=314 Ack=4430 Win=130784 Len=0 TSval=295761657 TSecr=550770013
  177   5.116772 168.150.105.141 → 162.125.7.4  TCP 1440 [TCP segment of a reassembled PDU]
  178   5.116785 168.150.105.141 → 162.125.7.4  TCP 1440 [TCP segment of a reassembled PDU]
  179   5.116791 168.150.105.141 → 162.125.7.4  TCP 1440 [TCP segment of a reassembled PDU]
  180   5.123735  162.125.7.4 → 168.150.105.141 TCP 66 443 → 55575 [ACK] Seq=4430 Ack=3062 Win=35328 Len=0 TSval=550770015 TSecr=295761659
  181   5.123778 168.150.105.141 → 162.125.7.4  TCP 1440 [TCP segment of a reassembled PDU]
  182   5.123788 168.150.105.141 → 162.125.7.4  TCP 1440 [TCP segment of a reassembled PDU]
  183   5.123799 168.150.105.141 → 162.125.7.4  TCP 1440 [TCP segment of a reassembled PDU]
  184   5.123802 168.150.105.141 → 162.125.7.4  TCP 1440 [TCP segment of a reassembled PDU]
  185   5.129183  162.125.7.4 → 168.150.105.141 TCP 66 443 → 55575 [ACK] Seq=4430 Ack=5810 Win=40960 Len=0 TSval=550770017 TSecr=295761659
  186   5.129186  162.125.7.4 → 168.150.105.141 TCP 66 443 → 55575 [ACK] Seq=4430 Ack=8558 Win=46592 Len=0 TSval=550770017 TSecr=295761665
  187   5.129230 168.150.105.141 → 162.125.7.4  TCP 1440 [TCP segment of a reassembled PDU]
  188   5.129239 168.150.105.141 → 162.125.7.4  TCP 1440 [TCP segment of a reassembled PDU]
  189   5.129244 168.150.105.141 → 162.125.7.4  TCP 1440 [TCP segment of a reassembled PDU]
  190   5.129248 168.150.105.141 → 162.125.7.4  TCP 1440 [TCP segment of a reassembled PDU]
  191   5.129265 168.150.105.141 → 162.125.7.4  TLSv1.2 1440 Application Data[TCP segment of a reassembled PDU]
  192   5.129271 168.150.105.141 → 162.125.7.4  TCP 1440 [TCP segment of a reassembled PDU]
  193   5.129275 168.150.105.141 → 162.125.7.4  TCP 1440 [TCP segment of a reassembled PDU]
  194   5.129278 168.150.105.141 → 162.125.7.4  TLSv1.2 1225 Application Data
  195   5.135118  162.125.7.4 → 168.150.105.141 TCP 66 443 → 55575 [ACK] Seq=4430 Ack=11306 Win=51712 Len=0 TSval=550770018 TSecr=295761665
  196   5.135125  162.125.7.4 → 168.150.105.141 TCP 66 443 → 55575 [ACK] Seq=4430 Ack=14054 Win=57344 Len=0 TSval=550770018 TSecr=295761670
  197   5.135127  162.125.7.4 → 168.150.105.141 TCP 66 443 → 55575 [ACK] Seq=4430 Ack=16802 Win=62976 Len=0 TSval=550770018 TSecr=295761670
  198   5.137565  162.125.7.4 → 168.150.105.141 TCP 66 443 → 55575 [ACK] Seq=4430 Ack=19550 Win=68608 Len=0 TSval=550770018 TSecr=295761670
  199   5.176704 168.150.105.141 → 162.125.7.4  TCP 1225 [TCP Retransmission] 55575 → 443 [PSH, ACK] Seq=19550 Ack=4430 Win=131072 Len=1159 TSval=295761715 TSecr=550770018
  200   5.176731  162.125.7.4 → 168.150.105.141 TCP 66 443 → 55575 [ACK] Seq=4430 Ack=20709 Win=71168 Len=0 TSval=550770029 TSecr=295761670
  201   5.182510  162.125.7.4 → 168.150.105.141 TCP 78 [TCP Dup ACK 200#1] 443 → 55575 [ACK] Seq=4430 Ack=20709 Win=71168 Len=0 TSval=550770030 TSecr=295761715 SLE=19550 SRE=20709
  202   5.439379  162.125.7.4 → 168.150.105.141 TLSv1.2 568 Application Data
  203   5.439419 168.150.105.141 → 162.125.7.4  TCP 66 55575 → 443 [ACK] Seq=20709 Ack=4932 Win=130560 Len=0 TSval=295761977 TSecr=550770081
  204   5.487191 168.150.105.141 → 162.125.7.3  TLSv1.2 1276 Application Data
  205   5.492956  162.125.7.3 → 168.150.105.141 TCP 66 443 → 55542 [ACK] Seq=593 Ack=2421 Win=81 Len=0 TSval=751968214 TSecr=295762024
  206   5.899380 168.150.105.141 → 74.125.197.189 TLSv1.2 906 Application Data
  207   5.899529 168.150.105.141 → 74.125.197.189 TCP 1434 [TCP segment of a reassembled PDU]
  208   5.899535 168.150.105.141 → 74.125.197.189 TLSv1.2 540 Application Data
  210   5.965359 74.125.197.189 → 168.150.105.141 TCP 66 443 → 55571 [ACK] Seq=3462 Ack=6254 Win=277 Len=0 TSval=3614857027 TSecr=295762434
  211   5.965363 74.125.197.189 → 168.150.105.141 TCP 66 443 → 55571 [ACK] Seq=3462 Ack=7622 Win=288 Len=0 TSval=3614857027 TSecr=295762434
  213   6.006370 74.125.197.189 → 168.150.105.141 TCP 66 443 → 55571 [ACK] Seq=3462 Ack=8096 Win=299 Len=0 TSval=3614857039 TSecr=295762434
  214   6.006374  162.125.7.3 → 168.150.105.141 TLSv1.2 668 Application Data
  215   6.006428 168.150.105.141 → 162.125.7.3  TCP 66 55542 → 443 [ACK] Seq=2421 Ack=1195 Win=4077 Len=0 TSval=295762540 TSecr=751968329
  216   6.011480 74.125.197.189 → 168.150.105.141 TLSv1.2 398 Application Data
  217   6.011482 74.125.197.189 → 168.150.105.141 TLSv1.2 275 Application Data
  218   6.011483 74.125.197.189 → 168.150.105.141 TLSv1.2 373 Application Data
  219   6.011484 74.125.197.189 → 168.150.105.141 TLSv1.2 385 Application Data, Application Data
  220   6.011512 168.150.105.141 → 74.125.197.189 TCP 66 55571 → 443 [ACK] Seq=8096 Ack=3794 Win=4085 Len=0 TSval=295762545 TSecr=3614857077
  221   6.011528 168.150.105.141 → 74.125.197.189 TCP 66 55571 → 443 [ACK] Seq=8096 Ack=4003 Win=4079 Len=0 TSval=295762545 TSecr=3614857078
  222   6.011533 168.150.105.141 → 74.125.197.189 TCP 66 55571 → 443 [ACK] Seq=8096 Ack=4310 Win=4069 Len=0 TSval=295762545 TSecr=3614857078
  223   6.011538 168.150.105.141 → 74.125.197.189 TCP 66 55571 → 443 [ACK] Seq=8096 Ack=4629 Win=4059 Len=0 TSval=295762545 TSecr=3614857078
  224   6.019501 74.125.197.189 → 168.150.105.141 TLSv1.2 112 Application Data
  225   6.019503 74.125.197.189 → 168.150.105.141 TLSv1.2 406 Application Data
  226   6.019504 74.125.197.189 → 168.150.105.141 TLSv1.2 428 Application Data
  227   6.019505 74.125.197.189 → 168.150.105.141 TLSv1.2 377 Application Data
  228   6.019536 168.150.105.141 → 74.125.197.189 TCP 66 55571 → 443 [ACK] Seq=8096 Ack=4675 Win=4094 Len=0 TSval=295762553 TSecr=3614857078
  229   6.019547 168.150.105.141 → 74.125.197.189 TCP 66 55571 → 443 [ACK] Seq=8096 Ack=5015 Win=4083 Len=0 TSval=295762553 TSecr=3614857079
  230   6.019553 168.150.105.141 → 74.125.197.189 TCP 66 55571 → 443 [ACK] Seq=8096 Ack=5377 Win=4072 Len=0 TSval=295762553 TSecr=3614857079
  231   6.019558 168.150.105.141 → 74.125.197.189 TCP 66 55571 → 443 [ACK] Seq=8096 Ack=5688 Win=4062 Len=0 TSval=295762553 TSecr=3614857080
  232   6.019755 168.150.105.141 → 74.125.197.189 TLSv1.2 112 Application Data
  234   6.062547 168.150.105.141 → 162.125.7.3  TLSv1.2 660 Application Data
  235   6.151749 74.125.197.189 → 168.150.105.141 TCP 66 443 → 55571 [ACK] Seq=5688 Ack=8142 Win=299 Len=0 TSval=3614857123 TSecr=295762553
  236   6.169720 168.150.105.141 → 162.125.7.3  TCP 660 [TCP Retransmission] 55542 → 443 [PSH, ACK] Seq=2421 Ack=1195 Win=4096 Len=594 TSval=295762701 TSecr=751968329
  237   6.185797  162.125.7.3 → 168.150.105.141 TCP 66 443 → 55542 [ACK] Seq=1195 Ack=3015 Win=86 Len=0 TSval=751968363 TSecr=295762595
  238   6.198147  162.125.7.3 → 168.150.105.141 TLSv1.2 567 Application Data
  239   6.198150  162.125.7.3 → 168.150.105.141 TCP 78 [TCP Dup ACK 237#1] 443 → 55542 [ACK] Seq=1696 Ack=3015 Win=86 Len=0 TSval=751968388 TSecr=295762701 SLE=2421 SRE=3015
  240   6.198189 168.150.105.141 → 162.125.7.3  TCP 66 55542 → 443 [ACK] Seq=3015 Ack=1696 Win=4080 Len=0 TSval=295762729 TSecr=751968381
  241   6.322282 162.125.34.129 → 168.150.105.141 TLSv1.2 586 Application Data
  242   6.322332 168.150.105.141 → 162.125.34.129 TCP 66 55090 → 443 [ACK] Seq=1 Ack=521 Win=4079 Len=0 TSval=295762853 TSecr=3457713739
  243   6.346344 168.150.105.141 → 162.125.7.3  TLSv1.2 1152 Application Data
  244   6.358007  162.125.7.3 → 168.150.105.141 TCP 66 443 → 55542 [ACK] Seq=1696 Ack=4101 Win=91 Len=0 TSval=751968429 TSecr=295762876
  245   6.683786  162.125.7.3 → 168.150.105.141 TCP 1440 [TCP segment of a reassembled PDU]
  246   6.683789  162.125.7.3 → 168.150.105.141 TCP 1440 [TCP segment of a reassembled PDU]
  247   6.683847 168.150.105.141 → 162.125.7.3  TCP 66 55542 → 443 [ACK] Seq=4101 Ack=4444 Win=4010 Len=0 TSval=295763211 TSecr=751968498
  248   6.684031 168.150.105.141 → 162.125.7.3  TCP 66 [TCP Window Update] 55542 → 443 [ACK] Seq=4101 Ack=4444 Win=4096 Len=0 TSval=295763211 TSecr=751968498
  249   6.684858  162.125.7.3 → 168.150.105.141 TLSv1.2 1151 Application Data
  250   6.684897 168.150.105.141 → 162.125.7.3  TCP 66 55542 → 443 [ACK] Seq=4101 Ack=5529 Win=4062 Len=0 TSval=295763212 TSecr=751968498
  251   6.749795 168.150.105.141 → 162.125.34.129 TLSv1.2 779 Application Data
  252   6.786583 162.125.34.129 → 168.150.105.141 TCP 66 443 → 55090 [ACK] Seq=521 Ack=714 Win=161 Len=0 TSval=3457713870 TSecr=295763276
